{
  "schemaVersion": "professional-candidate-v1",
  "source": {
    "sourceId": "module-four-acceptance-pack",
    "sourceVersion": "2026-07-25-candidate-v1",
    "sourceLocator": "六爻App模块四内容数据库缺失数据补全与生产验收包.txt",
    "revision": null,
    "sourceSha256": "537d3ec190263166c1a3f541c962c44ce12bec47ba30b5c8cdc2a8841c8953a4",
    "verificationStatus": "production_candidate"
  },
  "ruleset": {
    "id": "jingfang-yehe-baseline",
    "version": "1.0.0-candidate.1"
  },
  "trigrams": [
    {
      "id": "trigram-qian",
      "fields": {
        "palaceElement": "金",
        "houtianDirection": "西北",
        "familyRole": "父",
        "naturalImage": "天",
        "bodyPart": "首",
        "animal": "馬",
        "virtue": "健",
        "extendedImages": ["天", "圜", "君", "父", "玉", "金", "寒", "冰", "大赤", "木果"],
        "sourceLocator": "《易传·说卦》第七至第十一章及验收包第九节；待双人复核。"
      }
    },
    {
      "id": "trigram-kun",
      "fields": {
        "palaceElement": "土",
        "houtianDirection": "西南",
        "familyRole": "母",
        "naturalImage": "地",
        "bodyPart": "腹",
        "animal": "牛",
        "virtue": "順",
        "extendedImages": ["地", "母", "布", "釜", "吝嗇", "均", "文", "眾", "輿"],
        "sourceLocator": "《易传·说卦》第七至第十一章及验收包第九节；待双人复核。"
      }
    },
    {
      "id": "trigram-zhen",
      "fields": {
        "palaceElement": "木",
        "houtianDirection": "東",
        "familyRole": "長男",
        "naturalImage": "雷",
        "bodyPart": "足",
        "animal": "龍",
        "virtue": "動",
        "extendedImages": ["雷", "龍", "玄黃", "旉", "大塗", "長子", "決躁", "蒼筤竹"],
        "sourceLocator": "《易传·说卦》第七至第十一章及验收包第九节；待双人复核。"
      }
    },
    {
      "id": "trigram-xun",
      "fields": {
        "palaceElement": "木",
        "houtianDirection": "東南",
        "familyRole": "長女",
        "naturalImage": "風/木",
        "bodyPart": "股",
        "animal": "雞",
        "virtue": "入",
        "extendedImages": [
          "木",
          "風",
          "長女",
          "繩直",
          "工",
          "白",
          "長",
          "高",
          "進退",
          "不果",
          "臭"
        ],
        "sourceLocator": "《易传·说卦》第七至第十一章及验收包第九节；待双人复核。"
      }
    },
    {
      "id": "trigram-kan",
      "fields": {
        "palaceElement": "水",
        "houtianDirection": "北",
        "familyRole": "中男",
        "naturalImage": "水",
        "bodyPart": "耳",
        "animal": "豕",
        "virtue": "陷/險",
        "extendedImages": [
          "水",
          "溝瀆",
          "隱伏",
          "矯輮",
          "弓輪",
          "加憂",
          "心病",
          "耳痛",
          "血卦",
          "赤"
        ],
        "sourceLocator": "《易传·说卦》第七至第十一章及验收包第九节；待双人复核。"
      }
    },
    {
      "id": "trigram-li",
      "fields": {
        "palaceElement": "火",
        "houtianDirection": "南",
        "familyRole": "中女",
        "naturalImage": "火/日",
        "bodyPart": "目",
        "animal": "雉",
        "virtue": "麗/明",
        "extendedImages": ["火", "日", "電", "中女", "甲胄", "戈兵", "大腹", "乾卦", "鱉蟹螺蚌龜"],
        "sourceLocator": "《易传·说卦》第七至第十一章及验收包第九节；待双人复核。"
      }
    },
    {
      "id": "trigram-gen",
      "fields": {
        "palaceElement": "土",
        "houtianDirection": "東北",
        "familyRole": "少男",
        "naturalImage": "山",
        "bodyPart": "手",
        "animal": "狗",
        "virtue": "止",
        "extendedImages": ["山", "徑路", "小石", "門闕", "果蓏", "閽寺", "狗鼠", "黔喙之屬"],
        "sourceLocator": "《易传·说卦》第七至第十一章及验收包第九节；待双人复核。"
      }
    },
    {
      "id": "trigram-dui",
      "fields": {
        "palaceElement": "金",
        "houtianDirection": "西",
        "familyRole": "少女",
        "naturalImage": "澤",
        "bodyPart": "口",
        "animal": "羊",
        "virtue": "說/悅",
        "extendedImages": ["澤", "少女", "巫", "口舌", "毀折", "附決", "剛鹵", "妾", "羊"],
        "sourceLocator": "《易传·说卦》第七至第十一章及验收包第九节；待双人复核。"
      }
    }
  ],
  "palaceMemberships": [
    {
      "hexagramId": "hexagram-kw-01",
      "palaceTrigramId": "trigram-qian",
      "stage": "base",
      "shiPosition": 6,
      "yingPosition": 3
    },
    {
      "hexagramId": "hexagram-kw-44",
      "palaceTrigramId": "trigram-qian",
      "stage": "first-change",
      "shiPosition": 1,
      "yingPosition": 4
    },
    {
      "hexagramId": "hexagram-kw-33",
      "palaceTrigramId": "trigram-qian",
      "stage": "second-change",
      "shiPosition": 2,
      "yingPosition": 5
    },
    {
      "hexagramId": "hexagram-kw-12",
      "palaceTrigramId": "trigram-qian",
      "stage": "third-change",
      "shiPosition": 3,
      "yingPosition": 6
    },
    {
      "hexagramId": "hexagram-kw-20",
      "palaceTrigramId": "trigram-qian",
      "stage": "fourth-change",
      "shiPosition": 4,
      "yingPosition": 1
    },
    {
      "hexagramId": "hexagram-kw-23",
      "palaceTrigramId": "trigram-qian",
      "stage": "fifth-change",
      "shiPosition": 5,
      "yingPosition": 2
    },
    {
      "hexagramId": "hexagram-kw-35",
      "palaceTrigramId": "trigram-qian",
      "stage": "wandering-soul",
      "shiPosition": 4,
      "yingPosition": 1
    },
    {
      "hexagramId": "hexagram-kw-14",
      "palaceTrigramId": "trigram-qian",
      "stage": "returning-soul",
      "shiPosition": 3,
      "yingPosition": 6
    },
    {
      "hexagramId": "hexagram-kw-51",
      "palaceTrigramId": "trigram-zhen",
      "stage": "base",
      "shiPosition": 6,
      "yingPosition": 3
    },
    {
      "hexagramId": "hexagram-kw-16",
      "palaceTrigramId": "trigram-zhen",
      "stage": "first-change",
      "shiPosition": 1,
      "yingPosition": 4
    },
    {
      "hexagramId": "hexagram-kw-40",
      "palaceTrigramId": "trigram-zhen",
      "stage": "second-change",
      "shiPosition": 2,
      "yingPosition": 5
    },
    {
      "hexagramId": "hexagram-kw-32",
      "palaceTrigramId": "trigram-zhen",
      "stage": "third-change",
      "shiPosition": 3,
      "yingPosition": 6
    },
    {
      "hexagramId": "hexagram-kw-46",
      "palaceTrigramId": "trigram-zhen",
      "stage": "fourth-change",
      "shiPosition": 4,
      "yingPosition": 1
    },
    {
      "hexagramId": "hexagram-kw-48",
      "palaceTrigramId": "trigram-zhen",
      "stage": "fifth-change",
      "shiPosition": 5,
      "yingPosition": 2
    },
    {
      "hexagramId": "hexagram-kw-28",
      "palaceTrigramId": "trigram-zhen",
      "stage": "wandering-soul",
      "shiPosition": 4,
      "yingPosition": 1
    },
    {
      "hexagramId": "hexagram-kw-17",
      "palaceTrigramId": "trigram-zhen",
      "stage": "returning-soul",
      "shiPosition": 3,
      "yingPosition": 6
    },
    {
      "hexagramId": "hexagram-kw-29",
      "palaceTrigramId": "trigram-kan",
      "stage": "base",
      "shiPosition": 6,
      "yingPosition": 3
    },
    {
      "hexagramId": "hexagram-kw-60",
      "palaceTrigramId": "trigram-kan",
      "stage": "first-change",
      "shiPosition": 1,
      "yingPosition": 4
    },
    {
      "hexagramId": "hexagram-kw-03",
      "palaceTrigramId": "trigram-kan",
      "stage": "second-change",
      "shiPosition": 2,
      "yingPosition": 5
    },
    {
      "hexagramId": "hexagram-kw-63",
      "palaceTrigramId": "trigram-kan",
      "stage": "third-change",
      "shiPosition": 3,
      "yingPosition": 6
    },
    {
      "hexagramId": "hexagram-kw-49",
      "palaceTrigramId": "trigram-kan",
      "stage": "fourth-change",
      "shiPosition": 4,
      "yingPosition": 1
    },
    {
      "hexagramId": "hexagram-kw-55",
      "palaceTrigramId": "trigram-kan",
      "stage": "fifth-change",
      "shiPosition": 5,
      "yingPosition": 2
    },
    {
      "hexagramId": "hexagram-kw-36",
      "palaceTrigramId": "trigram-kan",
      "stage": "wandering-soul",
      "shiPosition": 4,
      "yingPosition": 1
    },
    {
      "hexagramId": "hexagram-kw-07",
      "palaceTrigramId": "trigram-kan",
      "stage": "returning-soul",
      "shiPosition": 3,
      "yingPosition": 6
    },
    {
      "hexagramId": "hexagram-kw-52",
      "palaceTrigramId": "trigram-gen",
      "stage": "base",
      "shiPosition": 6,
      "yingPosition": 3
    },
    {
      "hexagramId": "hexagram-kw-22",
      "palaceTrigramId": "trigram-gen",
      "stage": "first-change",
      "shiPosition": 1,
      "yingPosition": 4
    },
    {
      "hexagramId": "hexagram-kw-26",
      "palaceTrigramId": "trigram-gen",
      "stage": "second-change",
      "shiPosition": 2,
      "yingPosition": 5
    },
    {
      "hexagramId": "hexagram-kw-41",
      "palaceTrigramId": "trigram-gen",
      "stage": "third-change",
      "shiPosition": 3,
      "yingPosition": 6
    },
    {
      "hexagramId": "hexagram-kw-38",
      "palaceTrigramId": "trigram-gen",
      "stage": "fourth-change",
      "shiPosition": 4,
      "yingPosition": 1
    },
    {
      "hexagramId": "hexagram-kw-10",
      "palaceTrigramId": "trigram-gen",
      "stage": "fifth-change",
      "shiPosition": 5,
      "yingPosition": 2
    },
    {
      "hexagramId": "hexagram-kw-61",
      "palaceTrigramId": "trigram-gen",
      "stage": "wandering-soul",
      "shiPosition": 4,
      "yingPosition": 1
    },
    {
      "hexagramId": "hexagram-kw-53",
      "palaceTrigramId": "trigram-gen",
      "stage": "returning-soul",
      "shiPosition": 3,
      "yingPosition": 6
    },
    {
      "hexagramId": "hexagram-kw-02",
      "palaceTrigramId": "trigram-kun",
      "stage": "base",
      "shiPosition": 6,
      "yingPosition": 3
    },
    {
      "hexagramId": "hexagram-kw-24",
      "palaceTrigramId": "trigram-kun",
      "stage": "first-change",
      "shiPosition": 1,
      "yingPosition": 4
    },
    {
      "hexagramId": "hexagram-kw-19",
      "palaceTrigramId": "trigram-kun",
      "stage": "second-change",
      "shiPosition": 2,
      "yingPosition": 5
    },
    {
      "hexagramId": "hexagram-kw-11",
      "palaceTrigramId": "trigram-kun",
      "stage": "third-change",
      "shiPosition": 3,